{
  "schema": "frontend_acceptance_evidence_contract.v1",
  "baseline": {
    "baseline_sha": "87be79145ee6ed8bc8c28396b0defc3bdde1e980",
    "baseline_sha_source": "G1 branch cut point (main HEAD when the G1 acceptance baseline was frozen); traceable to origin/main via git merge-base --is-ancestor",
    "capability_inventory_path": "docs/planning/custom-frontend-integration/G1_CAPABILITY_INVENTORY.md"
  },
  "environment_assets": {
    "profiles_present": [
      "daily",
      "local",
      "production",
      "test"
    ],
    "assets": [
      {
        "path": "config/frontend/acceptance_environments_v1.json",
        "sha256": "a2f0b2154212187ad0e737feb908433dc3eefc1955283caecc7dcbe9922d3104"
      },
      {
        "path": "config/frontend/acceptance_tool_matrix_v1.json",
        "sha256": "3a0a8269089d3034782ad87a8a62547536c1dc75aece934b56d0661bdcf8a4fe"
      },
      {
        "path": "config/frontend/acceptance_evidence_contract_v1.schema.json",
        "sha256": "b5cc8e59e330d83cf05fa6aac4f1233039965ab4c50a7f3473229882d2258a42"
      }
    ]
  },
  "toolchain": {
    "python": "3.12.3",
    "git": "2.43.0"
  },
  "collected_at": "2026-10-22T05:38:16Z",
  "browser_evidence_contract": {
    "required_fields": [
      "browser_full_version",
      "browser_url",
      "capture_mode",
      "collected_at_and_tool_version",
      "dataset_id",
      "environment_id",
      "normalized_route",
      "product_service_static_shas",
      "role",
      "screenshot_digest",
      "viewport"
    ],
    "cross_env_reuse_forbidden": true
  }
}
